front,back
dataset,Conjunto estructurado de datos organizados para su análisis
dataframe,Estructura tabular de filas y columnas usada para manipular datos
feature,Variable o atributo individual usado como entrada en un modelo
outlier,Valor atípico que se desvía significativamente del resto de los datos
missing value,Dato ausente o no registrado en un conjunto de datos
data wrangling,Proceso de limpiar y transformar datos crudos en un formato utilizable
exploratory data analysis,Análisis inicial de datos para descubrir patrones y anomalías
correlation,Relación estadística entre dos variables que indica cómo cambian juntas
distribution,Función que describe la probabilidad de los posibles valores de una variable
standard deviation,Medida de dispersión que indica cuánto se alejan los datos de la media
normalization,"Proceso de escalar datos a un rango común, típicamente entre 0 y 1"
data pipeline,Secuencia automatizada de pasos para mover y transformar datos
ETL,"Proceso de extraer datos de una fuente, transformarlos y cargarlos en un destino"
hypothesis testing,Método estadístico para determinar si una suposición sobre los datos es válida
p-value,"Probabilidad de obtener un resultado al menos tan extremo como el observado, asumiendo que la hipótesis nula es cierta"
confidence interval,Rango de valores que probablemente contiene el verdadero parámetro poblacional
sampling bias,Error sistemático causado por una selección no representativa de datos
dimensionality reduction,Técnica para reducir el número de variables manteniendo la información esencial
cross-validation,Método de evaluación que divide los datos en subconjuntos para entrenar y validar un modelo
A/B testing,Experimento controlado que compara dos variantes para determinar cuál es más efectiva
supervised learning,Aprendizaje donde el modelo se entrena con datos etiquetados de entrada y salida esperada
unsupervised learning,Aprendizaje donde el modelo encuentra patrones en datos sin etiquetas
reinforcement learning,Aprendizaje donde un agente aprende a tomar decisiones mediante recompensas y penalizaciones
overfitting,Cuando un modelo se ajusta demasiado a los datos de entrenamiento y pierde capacidad de generalización
underfitting,Cuando un modelo es demasiado simple para capturar los patrones subyacentes en los datos
gradient descent,Algoritmo de optimización que ajusta los parámetros del modelo minimizando la función de pérdida
learning rate,Hiperparámetro que controla el tamaño de los pasos en la actualización de pesos durante el entrenamiento
loss function,Función que mide la diferencia entre la predicción del modelo y el valor real
epoch,Una pasada completa del algoritmo de entrenamiento sobre todo el conjunto de datos
batch size,Número de muestras procesadas antes de actualizar los parámetros del modelo
regularization,Técnica que penaliza la complejidad del modelo para prevenir el sobreajuste
hyperparameter,Parámetro cuyo valor se establece antes del entrenamiento y no se aprende de los datos
decision tree,Modelo que toma decisiones dividiendo los datos en ramas según condiciones sobre las variables
random forest,Conjunto de árboles de decisión que combina sus predicciones para mejorar la precisión
neural network,"Modelo computacional inspirado en el cerebro, compuesto por capas de neuronas interconectadas"
backpropagation,Algoritmo que calcula el gradiente del error y lo propaga hacia atrás para ajustar los pesos de la red
activation function,"Función que introduce no linealidad en una neurona, determinando si se activa o no"
convolutional neural network,"Red neuronal especializada en procesar datos con estructura de cuadrícula, como imágenes"
transfer learning,Técnica que reutiliza un modelo preentrenado en una tarea similar para acelerar el aprendizaje
ensemble method,Técnica que combina múltiples modelos para obtener predicciones más robustas y precisas
tokenization,Proceso de dividir un texto en unidades más pequeñas llamadas tokens
stemming,Técnica que reduce las palabras a su raíz eliminando sufijos morfológicos
lemmatization,Proceso de reducir una palabra a su forma base o lema usando análisis morfológico
stop words,Palabras muy frecuentes que generalmente se eliminan del texto por no aportar significado relevante
bag of words,Representación de texto como un conjunto de palabras sin considerar el orden ni la gramática
TF-IDF,Medida estadística que evalúa la importancia de una palabra en un documento respecto a un corpus
word embedding,Representación vectorial densa de palabras que captura relaciones semánticas entre ellas
named entity recognition,"Tarea de identificar y clasificar entidades como personas, lugares y organizaciones en un texto"
sentiment analysis,Proceso de determinar la actitud o emoción expresada en un texto
part-of-speech tagging,Asignación de categorías gramaticales a cada palabra de una oración
language model,Modelo probabilístico que predice la siguiente palabra o token dada una secuencia de texto
attention mechanism,Mecanismo que permite al modelo enfocarse en las partes más relevantes de la entrada
transformer,"Arquitectura de red neuronal basada en mecanismos de atención, sin recurrencia ni convolución"
sequence-to-sequence,Modelo que transforma una secuencia de entrada en una secuencia de salida de longitud variable
text classification,Tarea de asignar categorías predefinidas a fragmentos de texto
machine translation,Traducción automática de texto de un idioma a otro mediante modelos computacionales
corpus,Colección grande y estructurada de textos usada para entrenar y evaluar modelos de lenguaje
perplexity,Métrica que mide qué tan bien un modelo de lenguaje predice una muestra de texto
fine-tuning,Proceso de ajustar un modelo preentrenado con datos específicos de una tarea particular
hallucination,Generación de texto que parece plausible pero es factualmente incorrecto o inventado
efímero,"Que dura un solo día; pasajero, de corta duración"
ubicuo,Que está presente en todas partes al mismo tiempo
acérrimo,"Muy firme, tenaz o extremo en su postura o sentimientos"
perspicaz,Que tiene percepción mental aguda y penetrante
recóndito,"Muy escondido, reservado y oculto"
prístino,Que mantiene sin cambio alguno su naturaleza original
insigne,"Célebre, distinguido y notable por sus méritos"
exiguo,Muy escaso en cantidad o dimensión
incólume,Que no ha sufrido lesión ni menoscabo; ileso
acucioso,"Diligente, solícito; que hace las cosas pronto y con cuidado"
conspicuo,"Notable, sobresaliente e ilustre"
inicuo,Contrario a la equidad
ingente,Muy grande o numeroso
pusilánime,"Falto de ánimo y valor para intentar cosas grandes, tolerar las desgracias, enfrentarse a dificultades o defender ideas propias"
indolente,"Que no se afecta ni se inmuta; perezoso, apático"
pertinaz,"obstinado, terco o muy tenaz en su dictamen o resolución"
lacónico,parco en palabras; breve
falaz,Se dice de quien dice embusteces o emplea falsedades para engañar
ecuánime,Que juzga con imparcialidad y serenidad de ánimo
prolijo,"Largo, dilatado y extendido con exceso"
ecuestre,Perteneciente o relativo al caballo o a la equitación
coetáneo,"Que tiene la misma edad de aquel, aquella o aquello con que se le compara"
longevo,Muy anciano o de larga edad
inefable,Que no puede ser expresado o explicado con palabras
unívoco,Que tiene un solo significado
ambiguo,"Que puede entenderse de varios modos o admitir distintas interpretaciones, y dar, por consiguiente, motivo a dudas, incertidumbre o confusión"
pueril,Propio de o relativo a los niños o a la niñez
disímil,No semejante; diferente
subrepticio,"Que se hace o persigue de forma oculta, solapada o con disimulo"
espurio,"Que simula ser lo que no es, especialmente si es de origen dudoso o incierto"
diáfano,"Dicho de un cuerpo, que permite el paso de la luz casi en su totalidad"
ignoto,"Desconocido, no descubierto ni explorado"
vetusto,Muy antiguo o de mucha edad
feraz,"Sumamente fértil, copioso en frutos"
sempiterno,De duración infinita
iracundo,Propenso a la ira; que se encoleriza con facilidad
ominoso,"Que produce temor, rechazo o repugnancia por contener peligro, azar, o mala suerte; que se debe evitar o no desear"
cruento,Que implica o provoca gran efusión de sangre
inveterado,"antiguo, arraigado"
execrable,"Que merece condenarse, rechazarse o criticarse con severidad, por profanar algo considerado sagrado o muy valioso moralmente"
yermo,Que no tiene población
álgido,De una temperatura muy inferior a la normal o deseable; extremadamente frío
grandilocuente,Que escribe o habla con gran elocuencia o con un estilo elevado
recalcitrante,"reacio, obstinado en la resistencia"
pródigo,Que desperdicia y consume los bienes y caudal propios sin medida y de modo insensato
impávido,"Que no siente miedo, impertérrito ante el peligro"
contumaz,"Que no ceja en una decisión, pese a los pedidos o argumentos razonables en sentido contrario"
ineluctable,Se dice de algo que no se puede evitar o evadir
avieso,"atravesado, torcido, o fuera de norma"
dilecto,Amado con especial afecto y predilección
desidia,Falta de esfuerzo o dedicación para la realización de las tareas necesarias o prescritas
vehemencia,calidad o cualidad de vehemente o impetuoso
mesura,"gravedad, compostura"
displicencia,desagrado o indiferencia en el trato
acervo,Cúmulo de cosas u objetos pequeños colocados desordenadamente unos sobre otros
menoscabo,"Disminución del valor, la importancia o el prestigio de algo"
acopio,acopiar (juntar o acumular en cantidad)
desazón,falta de sabor y gusto
premura,"aprieto, apuro, prisa, urgencia, instancia"
denuedo,"Empleo de energía, valor, ánimo, vigor para lograr algo, en especial venciendo dificultades"
parsimonia,moderación en el gasto y en los placeres
fruición,Goce intenso; placer o deleite que se experimenta al disfrutar algo
desavenencia,discordia o desacuerdo entre personas
resquemor,Calor mordicante que producen en la lengua y paladar algunos mandajes y bebidas
desdén,Frialdad u hostilidad en el trato que reflejan la poca estima que se tiene por alguien
encono,"rencor arraigado en el ánimo, mala voluntad contra alguien"
inquina,"Antipatía, aversión, rechazo, mala voluntad hacia algo o alguien"
lascivia,deseo ardiente y censurable
probidad,integridad y honradez en el obrar
oprobio,deshonra o descrédito público
diletantismo,"Estado o comportamiento de diletante, de ser un aficionado o de participar superficialmente en algo, usualmente de las artes"
estulticia,"necedad, estupidez, tontería"
vileza,"Acción baja, indigna, infame"
contumelia,"oprobio, injuria u ofensa dicha a una persona en su cara"
abulia,falta patológica de voluntad o energía
aquiescencia,acuerdo que se presta pasivamente a una decisión o designio ajeno
clemencia,moderación en la severidad de un castigo
ignominia,Grave afrenta pública; gran deshonor o humillación
inopia,Dícese de una gran pobreza
petulancia,presunción exagerada y vana
resquicio,abertura que hay entre el quicio y la puerta
cariz,Aspecto o apariencia que toma un asunto o situación
derrotero,Camino o rumbo por el que se llega a un fin propuesto
coyuntura,"articulación, enlace móvil de extremidades óseas, revestidas de cartílago, mediante ligamentos elásticos alojados en una cápsula"
vestigio,Señal que queda en un sitio por donde se ha pisado o estado
diatriba,discurso o escrito violento e injurioso contra alguien o algo
precepto,mandamiento u ordenanza dada por una persona que tiene autorización para ello
salvedad,"Razonamiento o advertencia que se emplea como excusa, descargo, limitación o cortapisa de lo que se va a decir o hacer"
envergadura,"distancia que hay entre las puntas de las alas de una nave, de un ave o de cualquier otro animal, cuando éstas están totalmente extendidas"
menester,Ocupación habitual de un individuo
subterfugio,excusa bien elaborada y artificiosa
canon,regla o serie de reglas establecidas o aceptadas dentro de un arte concreto
epítome,exposición resumida del contenido de una obra
paradigma,modelo según el cual se producen otros objetos
prebenda,Renta aneja a un canonicato u otro oficio eclesiástico
corolario,"proposición a la que se llega sin esfuerzo o fácilmente, a partir de las premisas ya demostradas"
epílogo,Recapitulación de todo lo dicho en un discurso u otra composición literaria
dogma,creencia o principio cuya validez se da por sentada sin ulterior discusión en un determinado contexto
estigma,Marca que no se puede borrar
hegemonía,"dominio o supremacía que un grupo ejerce, de tal modo de dictar los términos y parámetros de la acción social en todos los sentidos y mantener la oposición fuera de la ley o la legitimidad"
dádiva,cosa que se da de forma gratuita y sin esperar nada a cambio
disyuntiva,Alternativa entre dos cosas por una de las cuales hay que optar
idiosincrasia,"naturaleza, temperamento o costumbres propios de un sujeto o grupo"
panacea,"medicamento capaz de curar todas o muchas enfermedades, o incluso de prolongar indefinidamente la vida"
plétora,Cantidad excesiva de sangre o de glóbulos rojos en un cuerpo
quimera,"Animal fantástico con cabeza de león, cuerpo de cabra y cola de dragón, y que según la fábula vomitaba llamas"
sinecura,"empleo o cargo con sueldo, que requiere poco o ningún trabajo"
usufructo,Derecho a utilizar o sacar provecho de bienes ajenos como si fueran propios con la obligación de conservar su esencia para el disfrute del dueño original cuando la ley lo señale
pocilga,recinto o edificio destinado a la vivienda de cerdos
baluarte,"Elemento de fortificación de una fortaleza, que consiste en una gola de entrada y un ángulo saliente en dos flancos, los cuales se unen al muro de la fortaleza. a menudo tiene forma pentagonal"
dilucidar,"explicar un asunto, aclararlo; dejar clara e inteligible alguna cosa"
esgrimir,"jugar o manejar la espada, el sable y otras armas blancas, reparando y deteniendo los golpes del contrario, o acometiéndole"
soslayar,colocar un objeto ladeado para cruzar una zona estrecha de un lado a otro
ponderar,Determinar el peso de una cosa
acaecer,"ocurrir, producirse un hecho, tener lugar un acontecimiento, suceder"
enmendar,"arreglar, corregir los fallos o defectos"
socavar,"excavar por debajo alguna cosa, dejándola sin la debida seguridad y resistencia"
abogar,defender y dar consejo a alguien que es objeto de un juicio o pleito legal
discernir,diferenciar conceptualmente una cosa de otra
aducir,Presentar razones o pruebas; presentar un alegato o argumentación
dirimir,Resolver o poner fin a una disputa o litigio
resarcir,"Reparar un daño, mediante el pago de un bien o la realización de una acción"
escatimar,"Dar o usar lo menos posible, o solo lo imprescindible, algún recurso"
desdeñar,Tratar con desdén a alguien; tratar algo con ostensible indiferencia o menosperecio; considerar inferior algo
vindicar,Defender a quien ha sido injuriado o calumniado; vengar una ofensa
usurpar,Apoderarse de una propiedad o de un derecho que pertenece a otro de una forma violenta
desistir,"Dejar de insistir, interrumpir un esfuerzo, una acción, etc"
atenuar,"reducir, disminuir o debilitar la fuerza, el efecto, la potencia o la intensidad de algo"
amedrentar,"infundir miedo, temor o aprensión"
avocar,disponer un tribunal de alzada de una causa que obraba en manos de uno inferior competente
coadyuvar,contribuir al logro o realización de una actividad
concatenar,"unir o conectar dos o más cosas siguiendo una serie o secuencia, a modo de cadena"
detentar,"ejercer ilegítimamente un puesto de responsabilidad o de representación en un ente público o privado, o de poder legislativo o gubernamental"
eludir,"huir la dificultad, salir de ella con algún artificio, etc"
elucidar,poner en claro algo
infligir,"Causar un daño, castigo o pena a alguien"
ostentar,mostrar o hacer patente una cosa. Presentar ante la vista
subyugar,forzar a la obediencia
transgredir,violar o quebrantar alguna norma o ley establecida
vincularse,"establecer o crear una conexión un vínculo, lazo o relación con otro u otros"
escindir,Separar o dividir en dos o más partes de importancia similar
holgar,"Descansar, tomar aliento después de alguna fatiga"
increpar,reprender a una persona con dureza y severidad
azuzar,incitar a un perro a que ladre o ataque
expiar,Limpiar o enmendar la culpa a través del cumplimiento de un castigo o penitencia
zaherir,Decir a alguien algo que le provoque humillación o dolor moral
denostar,Atacar verbalmente a alguien con graves insultos y ofensas
conminar,Amenazar con un castigo o una sanción para obligar a cumplir algo
medrar,"crecer, tener aumento los animales y plantas"
fulminar,Lanzar un castigo o condena de manera repentina y severa
hostigar,"azotar, castigar con látigo, vara u cosa semejante"
cernir,Separar con el cedazo la parte fina de la gruesa; amenazar algo de forma inminente
dilapidar,destruir o malgastar el patrimonio propio o aquel que se tiene a cargo
exacerbar,"Causar ira, causar muy grave enfado o enojo"
fustigar,Azotar con un látigo o vara; criticar con dureza
vilipendiar,Tratar con vilipendio a una persona o despreciar algo
enajenar,"transferir a otra persona la posesión de un bien, o algún derecho sobre ese bien"
abjurar,retractarse solemnemente y con juramento del error en que ha incurrido
claudicar,Terminar por ceder o rendirse a una presión o tentación
mancillar,Poner suciedad u otra sustancia en algo cambiando su aspecto
apostatar,"negar la fe cristiana que fue recibida al ser bautizado, declarando por tanto, a través de este acto, la voluntad de dejar de ser cristiano"
arrogar,"asignar, atribuir o conferir algo"
colegir,"Juntar cosas o personas esparcidas, en un mismo lugar"
concitar,Excitar inquietudes y sediciones
diferir,Postergar o dilatar la realización de algo
expoliar,Despojar con violencia o injusticia de los bienes a alguien
lucubrar,"Trabajar intelectualmente con dedicación e intensidad, especialmente de noche"
paliar,"mitigar, atenuar o mermar algo negativo"
preconizar,"Encomiar, tributar elogios públicamente a una persona o cosa"
suscitar,"Provocar o dar origen a un sentimiento, una reacción o un debate"
falacia,"engaño, fraude o mentira con que se intenta perjudicar a otro"
silogismo,"demostración que consta de tres proposiciones, una de las cuales se deduce del conjunto de las otras dos"
premisa,Principio por el cual se logran inferencias y alcanzan conclusiones
paradoja,"opinión o declaración opuesta a las ideas, opiniones, creencias o sentimientos de la mayoría de las personas"
retórica,"Arte de dar eficacia al lenguaje para obtener el objetivo deseado, especialmente estético o persuasivo"
sofisma,Razón o argumento aparente con que se quiere defender o persuadir lo que es falso
aforismo,"declaración o sentencia concisa; acordada por un gran número de personas (foro); que pretende expresar un principio o la verdad en una manera breve, pensativa y aparentemente cerrada"
elocuencia,"habilidad de expresarse con completa fluidez, con un amplio vocabulario y de modo eficaz para persuadir o producir una respuesta emotiva de quien recibe el mensaje"
apología,"Discurso de palabra o escrito, en defensa, justificación, alabanza o adulación de personas, actitudes o cosas"
demagogia,Práctica política consistente en ganarse con halagos el favor popular
metáfora,"figura retórica consistente en establecer una identidad entre dos términos y emplear uno con el significado del otro, basándose en una comparación no expresada entre las dos realidades que dichos términos designan"
metonimia,"tropo que designa una cosa con el nombre de otra con la que guarda una relación de causa efecto, de autor a obra, o de algún otro tipo de contigüidad temporal, causal o espacial"
sinécdoque,"tropo en el que: una parte de algo es usada para representar el todo, el todo es usado por una parte, la especie es usada por el género, el género es usado por la especie, el material de que algo está hecho es usado por la cosa"
oxímoron,expresión en la que se emplean dos términos incongruentes o contradictorios
hipérbole,"Exageración muy grande e intencional, que consiste en aumentar con el fin de obtener un enunciado más expresivo, como al decir: ""Te llamé un millón de veces"", ""un millón de gracias"" o ""te doy mil besos"""
antítesis,Oposición o contrariedad de dos juicios o afirmaciones
prosopopeya,enunciación de un discurso o una proposición por parte de un personaje en una obra literaria
elipsis,"Ausencia de alguna palabra en una oración, que no afecta su sentido"
anáfora,Figura retórica que consiste en la repetición de una o varias palabras al inicio de versos o frases sucesivas
pleonasmo,"Figura de construcción, que consiste en emplear en la oración uno o más vocablos innecesarios para que tenga sentido completo, pero con los cuales se da énfasis a lo dicho"
alegoría,invención o creación ficticia con sentido o significado diferentes al explícito
ironía,mofa o guasa delicada y fingida
litote,Figura retórica que consiste en negar lo contrario de lo que se quiere afirmar
perífrasis,Construcción léxica de múltiples palabras que expresa lo mismo que una sola unidad léxica particular
sinestesia,"Figura retórica que atribuye una sensación a un sentido que no le corresponde, como 'color cálido' o 'voz dulce'"
epíteto,"palabra con función adjetiva cuyo fin principal no es determinar o especificar el objeto o persona, sino caracterizarlo"
apóstrofe,"Figura retórica que consiste en hacer una interrupción del discurso dirigiéndose a una o varias personas, de manera vehemente, o a seres inanimados, o a personas ausentes o muertas"
polisíndeton,Figura que consiste en emplear repetidamente las conjunciones para enfatizar la expresión de los conceptos
asíndeton,figura de dicción consistente en la omisión de las conjunciones entre proposiciones para avivar el ritmo
aliteración,Repetición de sonidos semejantes en palabras próximas dentro de un texto
diégesis,mundo ficticio en el cual ocurre lo expresado
verosimilitud,Apariencia de verdadero o creíble; cualidad de lo que resulta posible dentro de su contexto
soliloquio,Representación teatral en la que un actor habla para sí mismo. Se diferencia del monólogo en que en éste el actor habla dirigiéndose al público
hagiografía,Historia o estudio de la vida de los santos de la Iglesia católica
exégesis,"explicación, interpretación"
epígrafe,frase descriptiva o explicativa que encabeza un escrito o cada una de las partes del mismo
idilio,"Poema bucólico, de carácter tierno y delicado, que tiene como asuntos las cosas del campo y los afectos amorosos de los pastores"
panegírico,"Perteneciente o relativo a la oración o discurso en alabanza de una persona; laudatorio, encomiástico"
elegía,"Poema corto y lírico que refleja pérdida, dolor o tristeza, casi siempre lamentando una muerte o ruina"
sátira,figura literaria de carácter irónico que tiene como propósito ridiculizar al objeto de la misma
ontología,"Parte de la metafísica que estudia el ser en tanto que es y existe. Por ello es llamada la teoría del ser, es decir, el estudio de todo lo que es: qué es, cómo es y cómo es posible"
epistemología,"campo de la filosofía que trata sobre los fundamentos, límites, y métodos del conocimiento científico"
axioma,verdad evidente que no requiere prueba o demostración
dialéctica,"Técnica formal de razonamiento que permite llegar a una verdad mediante el diálogo, intercambiando argumentos lógicos"
teleología,Doctrina que intenta explicar el universo como un sistema de relaciones causales con un propósito final
hermenéutica,"teoría y método para la interpretación de textos, que busca establecer el sentido original de un texto para su autor o para la comunidad en la que se produjo"
nihilismo,"negación de todo principio, autoridad o dogma filosófico o religioso"
solipsismo,teoría subjetiva que sostiene que tan sólo el propio yo es lo único que existe o que puede demostrarse
empirismo,"corriente filosófica según la cual el conocimiento se halla fundado en la experiencia. Se contrapone al racionalismo, para el cual el conocimiento se halla fundado en gran parte en la razón"
altruismo,"esmero y diligencia puesto por una persona en conseguir el bien de los demás, aun a expensas del propio"
escolástica,Corriente filosófica y teológica medieval basada en la articulación entre fe y razón
hedonismo,Doctrina filosófica que busca alcanzar una vida llena de placeres y supresión del dolor. El placer supremo es la máxima el fin último de la vida
estoicismo,"fortaleza o control sobre la propia emotividad, especialmente ante dolores o adversidades"
determinismo,Propiedad o condición de un sistema cuya evolución solo depende de sus condiciones iniciales
utilitarismo,"doctrina moral y filosófica que juzga el valor de las acciones por la utilidad &mdash;medida variadamente como el placer, el bienestar o la felicidad&mdash; que producen como consecuencia, no sólo para el autor de la misma sino para el conjunto de los seres racionales. Se opone por lo tanto a toda forma de moral categórica o deontológica, en la que determinados actos poseen valores intrínsecos e independientes de su contexto de realización"
relativismo,"idea o teoría sobre que algunos aspectos de la experiencia, como la moral o la verdad, son relativos"
pragmatismo,"Doctrina que adopta como criterio de verdad la utilidad práctica, identificando lo verdadero con lo útil"
racionalismo,"Sistema de pensamiento que prioriza el papel de la razón en la adquisición del conocimiento, en contraste con el empirismo, que resalta el de la experiencia, sobre todo el sentido de la percepción"
dogmatismo,presunción de los que quieren que su doctrina o sus aseveraciones sean tenidas por verdades inconcusas
